{
  "category": "war",
  "claims": [
    {
      "id": "claim-1",
      "retrieved_date": "2026-07-05",
      "source_name": "Cambridge University Press",
      "source_url": "https://www.cambridge.org/core/journals/iraq/article/abs/where-did-they-bury-the-kings-of-the-iiird-dynasty-of-ur/6C086629142E490A43BEA08F8AEA752D",
      "text": "The royal 'Mausolea' building complex at Ur excavated by Woolley is attributed to the Ur III kings, dated c. 2112-2004 BC, in P. R. S. Moorey's article 'Where did they Bury the Kings of the IIIrd Dynasty of Ur?' in the journal Iraq.",
      "verification_status": "verified"
    },
    {
      "id": "claim-2",
      "retrieved_date": "2026-07-05",
      "source_name": "Cambridge University Press",
      "source_url": "https://www.cambridge.org/core/journals/iraq/article/abs/giparu-at-ur/9A82B8A406B8F2BEC32B02FBF2CC008B",
      "text": "The journal Iraq article 'The Giparu at Ur' records (citing Jacobsen) that Ibbi-Sin, in his twenty-fourth regnal year, 'was defeated by Elam and Sua and carried off captive to Elam.'",
      "verification_status": "verified"
    },
    {
      "id": "claim-3",
      "retrieved_date": "2026-07-05",
      "source_name": "Cambridge University Press",
      "source_url": "https://assets.cambridge.org/97805218/28857/excerpt/9780521828857_excerpt.pdf",
      "text": "A Cambridge University Press book excerpt (Daniel E. Fleming, 'Democracy's Ancient Ancestors: Mari and Early Collective Governance') states that at the end of the third millennium the kingdom centered at Ur 'gave up ground on all fronts before falling to Elam,' and that after the destruction of the city of Ur the power vacuum was filled by Ishbi-Erra, commander of Ur's northern troops, who established his royal seat at Isin; it names Ibbi-Sin as the last king of Ur.",
      "verification_status": "verified"
    }
  ],
  "description": "Around 2004 BCE, forces from Elam and Shimashki (southwestern Iran) sacked the Sumerian capital of Ur, destroying the city and carrying its last king, Ibbi-Sin, captive to Elam. The attack ended the Third Dynasty of Ur (Ur III, c. 2112-2004 BCE), the last great centralized Sumerian state, whose final decades had been weakened by famine, Amorite incursions, and provincial defections. Power in southern Mesopotamia passed to Ishbi-Erra, a former Ur commander who founded a new dynasty at Isin, and the catastrophe was memorialized in Sumerian city laments.",
  "historical": {
    "date_display": "c. 2004 BCE",
    "era": "ancient",
    "impact": {
      "deaths_high": null,
      "deaths_low": null,
      "summary": "The death toll of the Elamite sack of Ur is unquantified: no contemporary casualty records survive, and the destruction is known chiefly from administrative archives that cease abruptly and from later Sumerian literary laments describing corpses in the city's streets. Scholarly sources describe the city's destruction and the king's capture but offer no numerical estimates, so deaths are recorded as null rather than inventing a range."
    },
    "location": {
      "country": "Iraq",
      "region": "Ur (Tell el-Muqayyar), southern Mesopotamia, near modern Nasiriyah"
    },
    "year_end": null,
    "year_start": -2003
  },
  "id": "fall-of-ur",
  "last_updated": "2026-07-06T09:21:41Z",
  "name": "Fall of Ur (Ur III Collapse)",
  "provenance": {
    "history": [
      {
        "at": "2026-07-06T09:21:41Z",
        "layer": "verify",
        "run_id": "2026-07-06T09-21-41Z-04aee2"
      }
    ],
    "last_layer": "verify",
    "last_run_id": "2026-07-06T09-21-41Z-04aee2"
  },
  "schema_version": "1.0",
  "sort_keys": {
    "chronology_rank": 7997,
    "composite": 79971.0,
    "impact_rank": 1
  },
  "verification": {
    "confidence": "high",
    "notes": "gate: 3 verified, 0 disputed, 0 unverified -> verified",
    "status": "verified"
  }
}
