{
  "category": "famine",
  "claims": [
    {
      "id": "claim-1",
      "retrieved_date": "2026-07-05",
      "source_name": "Cambridge University Press",
      "source_url": "https://www.cambridge.org/core/journals/european-journal-of-sociology-archives-europeennes-de-sociologie/article/empires-famine-and-the-significance-of-the-political-economy-of-colonialism-from-the-mughal-empire-to-british-colonial-rule-in-india/8412E24F05772E53C6149D92570B5A6F",
      "text": "The famine of 1770–71 in Bengal, Bihar, and Orissa affected a population of 30 million and, according to Warren Hastings, the subsequent governor-general, killed a third of that population — 10 million people — making it one of the most devastating famines in recorded human history, within five years of the East India Company taking over responsibility for the region.",
      "verification_status": "verified"
    },
    {
      "id": "claim-2",
      "retrieved_date": "2026-07-05",
      "source_name": "Cambridge University Press",
      "source_url": "https://www.cambridge.org/core/books/abs/history-of-bangladesh/british-impact/C788250C5797D948CED731EB5CFC6BB4",
      "text": "In the famine of 1769–70, remembered in Bengal as the Great Famine of 1176 (chhiyāttarer manbantar), it is thought that one third of Bengal's population — a staggering 10 million people — perished.",
      "verification_status": "verified"
    },
    {
      "id": "claim-3",
      "retrieved_date": "2026-07-05",
      "source_name": "Cambridge University Press",
      "source_url": "https://www.cambridge.org/core/books/abs/land-and-local-kingship-in-eighteenthcentury-bengal/famine-of-1770/932B785B5186FD79ADB4EC5FF5127F85",
      "text": "The famine of 1770, one of the greatest calamities in Bengal's history and one of only three major famines there in three centuries (with 1866 and 1943–44), carried off between one sixth and one third of the population, hitting western districts such as Bankura, Birbhum, Burdwan, and Hughli hardest; the East India Company refused to reduce revenue demands on the survivors.",
      "verification_status": "verified"
    },
    {
      "id": "claim-4",
      "retrieved_date": "2026-07-05",
      "source_name": "U.S. National Library of Medicine",
      "source_url": "https://pmc.ncbi.nlm.nih.gov/articles/PMC9735018/",
      "text": "The famine of 1770 was the first and worst of the famines under British rule in India and is estimated to have taken the lives of 10 million people; from 1770 to 1900, 25 million Indians are estimated to have died in famines.",
      "verification_status": "verified"
    }
  ],
  "description": "The Great Bengal Famine struck Bengal, Bihar, and Orissa in 1769–1770, within five years of the East India Company taking over revenue administration of the region. After successive crop failures, contemporary accounts held that about one third of the population perished — traditionally put at 10 million people — while the Company refused to reduce its land-revenue demands on the survivors. Remembered in Bengal as the chhiyāttarer manbantar (Great Famine of 1176 in the Bengali calendar), it is counted among the deadliest famines in recorded history.",
  "historical": {
    "date_display": "1769–1770",
    "era": "early-modern",
    "impact": {
      "deaths_high": 10000000,
      "deaths_low": 10000000,
      "summary": "The traditional estimate, deriving from Warren Hastings, is about 10 million dead — one third of an affected population of roughly 30 million in Bengal, Bihar, and Orissa — and Cambridge histories reckon the famine carried off between one sixth and one third of the population. That contemporary figure rests on no reliable demographic data, and modern revisionist historians (notably Rajat Datta) regard it as greatly inflated, arguing for a toll perhaps nearer 1–1.5 million; the point estimate recorded here preserves the traditional source figure, not a precise count."
    },
    "location": {
      "country": "India and Bangladesh (historical Bengal Presidency)",
      "region": "Bengal, Bihar, and Orissa — lower Ganges plain, worst in western Bengal districts (Bankura, Birbhum, Burdwan, Hughli)"
    },
    "year_end": 1770,
    "year_start": 1769
  },
  "id": "bengal-famine-1770",
  "last_updated": "2026-07-06T09:21:41Z",
  "name": "Great Bengal Famine of 1770",
  "provenance": {
    "history": [
      {
        "at": "2026-07-06T09:21:41Z",
        "layer": "verify",
        "run_id": "2026-07-06T09-21-41Z-980dba"
      }
    ],
    "last_layer": "verify",
    "last_run_id": "2026-07-06T09-21-41Z-980dba"
  },
  "schema_version": "1.0",
  "sort_keys": {
    "chronology_rank": 11769,
    "composite": 117695.0,
    "impact_rank": 5
  },
  "verification": {
    "confidence": "high",
    "notes": "gate: 4 verified, 0 disputed, 0 unverified -> verified",
    "status": "verified"
  }
}
